{
  "case_id": "eval-019-sparse-harm-statement",
  "scenario_type": "ambiguous_customer_harm",
  "artifacts": [
    {
      "artifact_type": "complaint",
      "text": "Customer says the explanation felt unfair and may have caused some confusion, but details are limited."
    }
  ],
  "expected_claims": [
    {
      "claim_type": "other",
      "claim_text_contains": "confusion"
    }
  ],
  "expected_outcomes": [
    "consumer_understanding"
  ],
  "expected_support_status": "weak_support",
  "expected_requires_review": true,
  "expected_recommended_action": "review",
  "expected_citation_targets": [
    {
      "artifact_type": "complaint"
    }
  ]
}