{
  "case_id": "eval-adv-006-sparse-delay-complaint",
  "scenario_type": "adversarial_formatting",
  "artifacts": [
    {
      "artifact_type": "complaint",
      "text": "support slow. waited. chased. no clear answer."
    }
  ],
  "expected_claims": [
    {
      "claim_type": "support_delay",
      "claim_text_contains": "waited"
    }
  ],
  "expected_outcomes": [
    "consumer_support"
  ],
  "expected_support_status": "weak_support",
  "expected_requires_review": true,
  "expected_recommended_action": "review",
  "expected_citation_targets": [
    {
      "artifact_type": "complaint"
    }
  ]
}