{
  "case_id": "eval-adv-003-short-fragment-fee",
  "scenario_type": "adversarial_formatting",
  "artifacts": [
    {
      "artifact_type": "complaint",
      "text": "fee? hidden? £5?"
    }
  ],
  "expected_claims": [
    {
      "claim_type": "unclear_fee",
      "claim_text_contains": "fee"
    }
  ],
  "expected_outcomes": [
    "price_value",
    "consumer_understanding"
  ],
  "expected_support_status": "missing_support",
  "expected_requires_review": true,
  "expected_recommended_action": "review",
  "expected_citation_targets": [
    {
      "artifact_type": "complaint"
    }
  ]
}