{
  "case_id": "eval-route-001-low-confidence",
  "scenario_type": "low_confidence",
  "artifacts": [
    {
      "artifact_type": "complaint",
      "text": "Customer vaguely mentions possible confusion about terms but provides little detail."
    }
  ],
  "expected_claims": [
    {
      "claim_type": "unclear_fee",
      "claim_text_contains": "confusion"
    }
  ],
  "expected_outcomes": [
    "consumer_understanding"
  ],
  "expected_support_status": "weak_support",
  "expected_requires_review": true,
  "expected_recommended_action": "review",
  "expected_citation_targets": [
    {
      "artifact_type": "complaint"
    }
  ]
}