{
  "case_id": "eval-cite-002-support-transcript-policy",
  "scenario_type": "citation_validation",
  "artifacts": [
    {
      "artifact_type": "complaint",
      "text": "Customer says support took too long and updates were inconsistent."
    },
    {
      "artifact_type": "support_transcript",
      "text": "Support transcript records delayed updates, unresolved follow-ups, and missed response times."
    },
    {
      "artifact_type": "policy_excerpt",
      "text": "Support policy requires prompt updates and timely customer communication throughout case handling."
    }
  ],
  "expected_claims": [
    {
      "claim_type": "support_delay",
      "claim_text_contains": "too long"
    }
  ],
  "expected_outcomes": [
    "consumer_support"
  ],
  "expected_support_status": "supported",
  "expected_requires_review": false,
  "expected_recommended_action": "approve",
  "expected_citation_targets": [
    {
      "artifact_type": "support_transcript"
    },
    {
      "artifact_type": "policy_excerpt"
    }
  ]
}