{
  "case_id": "eval-012-suitability-easy-access",
  "scenario_type": "poor_outcome_indicator",
  "artifacts": [
    {
      "artifact_type": "complaint",
      "text": "Customer says the recommended product did not match their need for easy access to funds."
    },
    {
      "artifact_type": "internal_note",
      "text": "Adviser note records the customer asked for easy access and low penalties."
    }
  ],
  "expected_claims": [
    {
      "claim_type": "poor_outcome_indicator",
      "claim_text_contains": "did not match"
    }
  ],
  "expected_outcomes": [
    "products_services"
  ],
  "expected_support_status": "weak_support",
  "expected_requires_review": true,
  "expected_recommended_action": "review",
  "expected_citation_targets": [
    {
      "artifact_type": "complaint"
    },
    {
      "artifact_type": "internal_note"
    }
  ]
}